{
  "$schema": "https://json-schema.org/draft-07/schema#",
  "$id": "https://contracts.neuronews.com/schemas/article-ingest-v1.json",
  "title": "ArticleIngest v1",
  "description": "Raw article as captured by crawlers",
  "type": "object",
  "properties": {
    "article_id": {
      "type": "string",
      "minLength": 1,
      "description": "Unique identifier for the article"
    },
    "source_id": {
      "type": "string",
      "minLength": 1,
      "description": "Identifier of the news source/publisher"
    },
    "url": {
      "type": "string",
      "format": "uri",
      "description": "Original URL where the article was published"
    },
    "title": {
      "type": ["string", "null"],
      "description": "Article headline/title"
    },
    "body": {
      "type": ["string", "null"],
      "description": "Full article content/body text"
    },
    "language": {
      "type": "string",
      "pattern": "^[a-z]{2}$",
      "description": "Article language using ISO 639-1 code (e.g., 'en', 'es', 'fr')",
      "examples": ["en", "es", "fr", "de", "it", "pt", "ru", "zh", "ja", "ar"]
    },
    "country": {
      "type": ["string", "null"],
      "pattern": "^[A-Z]{2}$",
      "description": "Country of publication using ISO 3166-1 alpha-2 code (e.g., 'US', 'UK', 'FR')",
      "examples": ["US", "UK", "FR", "DE", "ES", "IT", "JP", "CN", "RU", "BR"]
    },
    "published_at": {
      "type": "string",
      "format": "date-time",
      "description": "Timestamp when the article was originally published (ISO 8601 format)"
    },
    "ingested_at": {
      "type": "string",
      "format": "date-time",
      "description": "Timestamp when the article was ingested by our system (ISO 8601 format)"
    },
    "sentiment_score": {
      "type": ["number", "null"],
      "minimum": -1.0,
      "maximum": 1.0,
      "description": "Sentiment score ranging from -1 (negative) to 1 (positive), null if not analyzed"
    },
    "topics": {
      "type": "array",
      "items": {
        "type": "string",
        "minLength": 1
      },
      "uniqueItems": true,
      "default": [],
      "description": "Array of topic tags or categories associated with the article"
    }
  },
  "required": [
    "article_id",
    "source_id", 
    "url",
    "language",
    "published_at",
    "ingested_at"
  ],
  "additionalProperties": false,
  "examples": [
    {
      "article_id": "550e8400-e29b-41d4-a716-446655440000",
      "source_id": "bbc-news",
      "url": "https://www.bbc.com/news/technology-12345678",
      "title": "Breakthrough in AI Technology Announced",
      "body": "Scientists have announced a major breakthrough in artificial intelligence technology that could revolutionize...",
      "language": "en",
      "country": "UK",
      "published_at": "2025-08-28T10:30:00Z",
      "ingested_at": "2025-08-28T10:35:42Z",
      "sentiment_score": 0.75,
      "topics": ["technology", "artificial-intelligence", "innovation", "research"]
    },
    {
      "article_id": "6ba7b810-9dad-11d1-80b4-00c04fd430c8",
      "source_id": "reuters",
      "url": "https://www.reuters.com/business/finance/market-update-20250828",
      "title": null,
      "body": "Markets showed mixed performance today as investors weighed...",
      "language": "en",
      "country": null,
      "published_at": "2025-08-28T14:15:30Z",
      "ingested_at": "2025-08-28T14:20:15Z",
      "sentiment_score": null,
      "topics": ["finance", "markets", "business"]
    }
  ]
}
