{
  "article_id": "6ba7b810-9dad-11d1-80b4-00c04fd430c8",
  "source_id": "reuters",
  "url": "https://www.reuters.com/business/finance/market-update-20250828",
  "title": null,
  "body": "Markets showed mixed performance today as investors weighed the latest economic data. The technology sector saw gains while energy stocks declined. Trading volumes remained above average as market participants assessed the implications of recent policy announcements.",
  "language": "en",
  "country": null,
  "published_at": "2025-08-28T14:15:30Z",
  "ingested_at": "2025-08-28T14:20:15Z",
  "sentiment_score": null,
  "topics": ["finance", "markets", "business", "economy"]
}
