{
  "article_id": "c9bf9e57-1685-4c89-bafb-ff5af830be8a",
  "source_id": "el-pais",
  "url": "https://elpais.com/deportes/futbol/2025-08-28/champions-league-final",
  "title": "Final de la Champions League marca récord de audiencia",
  "body": null,
  "language": "es",
  "country": "ES",
  "published_at": "2025-08-28T20:30:00Z",
  "ingested_at": "2025-08-28T20:32:45Z",
  "sentiment_score": 0.85,
  "topics": ["deportes", "fútbol", "champions-league", "audiencia", "récord"]
}
