{
  "article_id": "550e8400-e29b-41d4-a716-446655440000",
  "source_id": "bbc-news",
  "url": "https://www.bbc.com/news/technology-12345678",
  "title": "Breakthrough in AI Technology Announced",
  "body": "Scientists have announced a major breakthrough in artificial intelligence technology that could revolutionize how we interact with computers. The new system, developed by researchers at a leading university, demonstrates unprecedented capabilities in natural language understanding and generation. This advancement builds upon years of research in machine learning and neural networks, representing a significant step forward in the field of artificial intelligence.",
  "language": "en",
  "country": "UK",
  "published_at": "2025-08-28T10:30:00Z",
  "ingested_at": "2025-08-28T10:35:42Z",
  "sentiment_score": 0.75,
  "topics": ["technology", "artificial-intelligence", "innovation", "research", "machine-learning"]
}
