{
  "article_id": "f47ac10b-58cc-4372-a567-0e02b2c3d479",
  "source_id": "le-monde",
  "url": "https://www.lemonde.fr/politique/article/2025/08/28/nouvelle-politique",
  "title": "Nouvelle politique économique annoncée",
  "body": "Le gouvernement a dévoilé aujourd'hui sa nouvelle politique économique, axée sur la transition écologique et la digitalisation. Cette stratégie vise à positionner le pays comme leader dans les technologies vertes tout en soutenant l'innovation dans le secteur numérique.",
  "language": "fr",
  "country": "FR",
  "published_at": "2025-08-28T16:45:00Z",
  "ingested_at": "2025-08-28T16:50:12Z",
  "sentiment_score": 0.3,
  "topics": ["politique", "économie", "transition-écologique", "innovation", "technologies-vertes"]
}
